{
  "id": "veloria/q_r09_noemi",
  "version": 1,
  "displayName": "Allenamento con Noemi",
  "steps": [
    {
      "id": "trial",
      "trigger": "battle/r09_noemi/defeated",
      "setFlag": "q_r09_noemi_helped",
      "requiresFlags": []
    }
  ],
  "completionFlag": "q_r09_noemi_helped",
  "reward": {}
}
